<?xml version="1.0" encoding="utf-8"?>
<xs:schema xmlns:xs="http://www.w3.org/2001/XMLSchema">
    <xs:element name="chatrooms">
        <xs:complexType>
            <xs:sequence>
                <xs:element name="chatroom" minOccurs="0" maxOccurs="unbounded">
                    <xs:complexType>
                        <xs:sequence>
                            <xs:element name="chatroomName" type="xs:string"/>
                            <xs:element name="chatroomAvatar">
                                <xs:complexType>
                                    <xs:sequence>
                                        <xs:element name="image" maxOccurs="1">
                                            <xs:complexType>
                                                <xs:simpleContent>
                                                    <xs:extension base="xs:string">
                                                        <xs:attribute name="name" type="xs:string" use="required"/>
                                                    </xs:extension>
                                                </xs:simpleContent>
                                            </xs:complexType>
                                        </xs:element>
                                    </xs:sequence>
                                </xs:complexType>
                            </xs:element>
                            <xs:element name="chatroomMembers" type="xs:positiveInteger"/>
                            <xs:element name="chatroomDescription" type="xs:string"/>
                        </xs:sequence>
                        <xs:attribute name="id" type="xs:positiveInteger" use="required"/>
                    </xs:complexType>
                </xs:element>
            </xs:sequence>
        </xs:complexType>
    </xs:element>
</xs:schema>