<?xml version="1.0" encoding="utf-8"?>
<chatrooms xmlns:xsi="http://www.w3.org/2001/XMLSchema-instance"
xsi:noNamespaceSchemaLocation="chatrooms.xsd">
    <chatroom id="1">
        <chatroomName>The Three Musketeers</chatroomName>
        <chatroomAvatar>
            <image name="Room avatar">image.jpg</image>
        </chatroomAvatar>
        <chatroomMembers>3</chatroomMembers>
        <chatroomDescription>Jing, Kento and Justin's hangout</chatroomDescription>
    </chatroom>
    <chatroom id="2">
        <chatroomName>Jingy's MapleStory Chat</chatroomName>
        <chatroomAvatar>
            <image name="Room avatar">image2.jpg</image>
        </chatroomAvatar>
        <chatroomMembers>10</chatroomMembers>
        <chatroomDescription>A place where you can talk about your favorite game, MapleStory!</chatroomDescription>
    </chatroom>
</chatrooms>

